{
 "$schema": "https://json-schema.org/draft/2020-12/schema",
 "title": "JFG-Studio levels/<name>/level.json",
 "type": "object",
 "required": ["format", "name", "track", "header"],
 "additionalProperties": false,
 "properties": {
  "format": {"const": 1},
  "name": {"type": "string", "minLength": 1, "maxLength": 31, "description": "the level's name in the game (header +0x00)"},
  "base": {"type": "string", "description": "stock:level/<n>: this is an edit of a stock level: its objects are added to the level's own list and its header fields change the stock header (the port's level patches)"},
  "fixedId": {"type": "integer", "minimum": 0, "maximum": 2047, "description": "phase 0 only: the level id to use until the port's content linker exists"},
  "fixedObjectLists": {
   "type": "object",
   "required": ["slot0", "slot1"],
   "additionalProperties": false,
   "description": "phase 0 only: the object lists to replace (an unused level's) until the content linker exists",
   "properties": {"slot0": {"type": "integer", "minimum": 0}, "slot1": {"type": "integer", "minimum": 0}}
  },
  "track": {"type": "string", "description": "pack:track/<name> (geometry/<name>.glb) or stock:track/<n>"},
  "sky": {"type": "integer", "minimum": -1, "description": "sky object id (header +0x58), -1 = none (black)"},
  "header": {
   "type": "object",
   "description": "header fields by name (decomp levels.py names); unnamed fields come from the neutral template",
   "additionalProperties": {"type": "integer"},
   "properties": {
    "cutsceneData": {"type": "integer"},
    "world": {"type": "integer"},
    "region": {"type": "integer"},
    "regionIndex": {"type": "integer"}
   }
  },
  "ambient": {"type": "array", "maxItems": 3, "items": {"type": "integer", "minimum": -1}, "description": "looping ambient sounds (header +0x108), -1 = none"},
  "music": {"type": "string", "description": "pack:music/<name> (OGG) or stock:music/<sequence>"},
  "planet": {"type": "string", "description": "a planet of the project (planets/<name>.json): the level is in that planet's region, so leaving the planet by an exit shows the game's stats screen and entering it shows its name (the port numbers the region; header region and regionIndex are set by the build)"}
 }
}
